question,answer_LLAMA,summary_bart,summary_llama,label_LLAMA,label_bart,label_llama
Why does cold weather smell different than warm weather?,"The answer is simple: cold weather smells different than warm weather because the air is colder and there's less moisture in it. In warm weather, the air is more humid, which is why it smells so much more. In cold weather, the air is much drier, which is why it smells so much more. In the case of the nose, cold air is more dense than warm air, so it's more likely that the cold air is carrying more particles (like dust, pollen, etc.) into the nostrils. This is why cold weather smells so much more. In warm weather, the air is more humid, which is why it smells so much more. It's also possible that cold weather smells different because the air is so dry that it's not able to hold much moisture. This would be why it smells so much more.<|eot_id|>","Volatile Organic Compounds (VOCs) are tiny molecules that are released from various substances, including plants, animals, and pollutants. They can be present in the air at different concentrations depending on the weather conditions. In cold weather, the air tends to be drier and more concentrated, which means more VOCs are available to be detected.","Cold weather and warm weather can affect the smell of the air due to changes in chemical composition and the presence of certain volatile organic compounds (VOCs). Here's what happens: - Cold weather increases the concentration of certain VOCs, such as methane, isopovaleric acid, and hydrogen sulfide, which our noses can detect. - The ozone layer is more active during cold weather, releasing more free radicals and reactive oxygen species that react with VOCs, creating new and different compounds. - Cold weather is drier, leading to the formation of more VOCs, which our noses can detect. - The biosphere and atmospheric circulation patterns also influence the types",0,1,0
Do marshmallows get bigger or smaller in space?,"They will expand in the same way that a balloon does. If you had a balloon and you put a marshmallow inside it, and then you inflated the balloon, the marshmallow would expand, and the balloon would expand. The marshmallow would get bigger, and the balloon would get bigger. If you put a marshmallow inside a balloon, and then you inflated the balloon, the marshmallow would get smaller. The balloon would get smaller. If you put a marshmallow inside a balloon, and then you inflated the balloon, the marshmallow would get bigger. The balloon would get bigger. If you put a marshmallow inside a balloon, and then you inflated the balloon, the marshmallow would get smaller. The balloon would get smaller. So the answer is that they get bigger or smaller, depending on what is inside the balloon.<|eot_id|>","Without gravity pulling them down, marshmallows would experience an upward force due to their buoyancy. This would cause them to float away from the surface of the spacecraft. In the absence of air resistance, they would not be subject to the same forces that would normally slow them down.","In space, marshmallows would float away from the surface due to buoyancy and air resistance, but not be subject to surface friction, leading to a loss of size.",0,1,1
Why do different foods of the same mass have different amounts of calories?,"Calories are a measure of energy. Calories are measured by the amount of energy that a substance can provide when it is burned. The amount of energy that a substance can provide is measured by the amount of heat that it releases when it is burned. Different foods have different amounts of energy. The reason that the same amount of food can have different amounts of calories is because of the different amounts of energy that different substances can provide when burned. For example, a loaf of bread has a lot more energy than a piece of fruit, but the same amount of energy. The reason that the same amount of food can have different amounts of calories is because of the different amounts of energy that different substances can provide when burned. For example, a loaf of bread has a lot more energy than a piece of fruit, but the same amount of energy. The reason that the same amount of food can have different amounts of calories is because of the different amounts of energy that different substances can provide when burned. For example, a loaf of bread has a lot more energy than a piece of fruit, but the same amount of energy. The reason that the same amount of food can have different amounts of calories is because of the different amounts of energy that different substances can provide when burned. For example, a loaf of bread has a lot more energy than a piece of fruit, but the same amount of energy.<|eot_id|>","Foods of the same mass have different amounts of calories due to variations in their composition. Whole wheat bread typically contains more carbohydrates than white bread, while lean meats tend to have higher protein content. Foods with different water contents have varying amounts of calorie per gram.","Different foods have varying amounts of calories due to differences in macronutrients (carbohydrates, proteins, and fats), water content, fiber content, and nutrient density. Foods with higher nutrient densities tend to have higher calorie values. Additionally, foods with higher energy densities tend to have higher calorie values. These differences can result in significant variations in calorie content, even for foods of the same mass.",0,1,0
Can someone describe why a circle only has one dimension?,"The number of dimensions of a space is determined by the number of independent coordinates we can define for a point in that space. If you have three independent coordinates, you can define a plane in 3D space. If you have four, you can define a 3D space. If you have five, you can define a 4D space. If you have six, you can define a 5D space. If you have seven, you can define a 6D space. If you have eight, you can define a 7D space. If you have nine, you can define a 8D space. If you have ten, you can define a 9D space. If you have eleven, you can define a 10D space. If you have twelve, you can define a 11D space. If you have thirteen, you can define a 12D space. If you have fourteen, you can define a 13D space. If you have fifteen, you can define a 14D space. If you have sixteen, you can define a 15D space. If you have seventeen, you can define a 16D space. If you have eighteen, you can define a 17D space. If you have nineteen, you can define a 18D space. If you have twenty, you can define a 19D space. If you have twenty-one, you can define a 20D space. If you have twenty-two, you can define a 21D space. If you have twenty-three, you can define a 22D space. If you have twenty-four, you can define a 23D space. If you have twenty-five, you can define a 24D space. If you have twenty-six, you can define a 25D space. If you have twenty-seven, you can define a 26D space. If you have twenty-eight, you can define a 27D space. If you have twenty-nine, you can define a 28D space. If you have thirty, you can define a 29D space. If you have thirty-one, you can define a 30D space. If you have thirty-two, you can define a 31D space. If you have thirty-three, you can define a 32D space. If you have thirty-four, you can define a 33D space. If you have thirty-five, you can define a 34D space. If you have thirty-six, you","In mathematics, a circle is defined as the set of all points in a plane that are the same distance from a fixed point, called the center. Every point on the circumference of the circle is equidistant from the center, which means that the circle has only one dimension. This concept is often expressed mathematically using the equation d = r.","d = r, where d is the distance from the center to the circumference and r is the radius of the circle.",0,1,1
Why does my voice get deeper when I have a cold?,"Your vocal cords are made of muscle tissue. When you're sick, the swelling of your body causes the vocal cords to swell. This is why you get a sore throat. Now, when your vocal cords swell, the muscle tissue gets stretched. This causes the muscle to contract and tighten. This contraction is what causes your voice to deepen. When you're sick, your body is trying to fight off the infection, and to do that, it needs to produce more mucus. The mucus is a protective fluid that coats the inside of your throat, and prevents the infection from spreading. The mucus also acts as a lubricant, allowing your vocal cords to vibrate more easily. This vibration causes the muscle tissue to contract and tighten, causing your voice to deepen.<|eot_id|>","When you have a cold, your body is trying to fight off the infection. As a result, your vocal cords can become inflamed and irritated. This inflammation can cause them to become swollen and tender, leading to a deeper, more resonant voice.","When you have a cold, your vocal cords can become inflamed and irritated, leading to a deeper voice. Possible reasons for a deeper voice include: * Vocal cord swelling due to inflammation * Increased mucus production in the throat * Vocal cord irritation from the cold * Hormonal changes that may contribute to vocal cord inflammation To alleviate a deeper voice, try: * Staying hydrated to thin out mucus and reduce inflammation * Using a humidifier to add moisture to the air * Gargling with salt water to help reduce inflammation * Getting plenty of rest and avoiding loud noises * Taking over-the-counter medications to help alleviate symptoms.",0,1,1
What is a constituent country and how does it differ from units like state or provinces?,"In the UK, for example, Scotland, Wales and Northern Ireland are all separate countries. They are each their own nation and are ruled by their own governments. Scotland has its own parliament and is part of the UK. Wales has its own parliament and is part of the UK. Northern Ireland is part of the UK and has its own parliament. Each of these countries has its own government, laws, currency, and currency system, and is independent of the rest of the UK. There are many other countries that are not part of the UK. For example, France is a country, but it is divided into 4 regions called departments, and each region has its own government, laws, currency, and currency system.<|eot_id|>","The term ""constituent country"" is often used in international relations, diplomacy, and international law. Constituent countries are smaller countries with their own governments, laws, and institutions. Units like states or provinces are larger countries with a single government and laws.","A constituent country is a smaller country within a larger country, with its own government, laws, and institutions. Unlike states or provinces, constituent countries are not subject to the parent country's laws, but are recognized as sovereign states by the international community. They often have more autonomy and control over their internal affairs. Examples of constituent countries include the UK, Ireland, Canada, Australia, and China.",0,1,1
How would electricity be generated from a self-sustaining Fusion Reaction?,"Fusion reactions produce energy. A fusion reactor is designed to use the energy produced by the fusion reaction to power the reactor. The reactor is also designed to control the amount of energy that is produced. In order to control the amount of energy produced, you need to control the amount of fusion reaction. This is done by adjusting the temperature of the plasma inside the reactor. The temperature of the plasma is controlled by the pressure inside the reactor. The pressure is controlled by the size of the reactor. The size of the reactor is controlled by the amount of materials that are used to build the reactor. The amount of materials used to build the reactor is controlled by the amount of materials that are available. The amount of materials available is controlled by the amount of materials that are available in the country. The amount of materials available is controlled by the government. The government controls the amount of materials available to build the reactor.<|eot_id|>","Fusion reactions involve the combination of atomic nuclei to form a more stable nucleus. In a self-sustaining fusion reaction, the reaction would be so hot and dense that it would create a feedback loop. This feedback loop would continue to produce energy without external input. Theoretical energy conversion would convert the energy released from the fusion reaction into electrical energy.","Self-sustaining fusion is a hypothetical idea where a fusion reaction is so hot and dense that it can produce energy without external input. In a hypothetical fusion reactor, the reaction would convert energy into electrical energy using thermoelectric materials. However, achieving self-sustaining conditions and overcoming challenges like low efficiency and scalability are significant hurdles. Researchers have explored related concepts, such as inertial confinement fusion and high-temperature reactors, but a self-sustaining fusion reaction is still a theoretical idea.",0,1,1
"What happens when you swallow blood, what happens to it in the process of digestion?","The blood is not swallowed. You are right that it is not digested, but it is swallowed, and it is swallowed because it is not digested. The blood is swallowed because it is not digested, and it is swallowed because it is not digested. The blood is swallowed because it is not digested, and it is swallowed because it is not digested, and it is swallowed because it is not digested, and it is swallowed because it is not digested. It is swallowed because it is not digested, and it is swallowed because it is not digested, and it is swallowed because it is not digested, and it is swallowed because it is not digested. The blood is swallowed because it is not digested, and it is swallowed because it is not digested, and it is swallowed because it is not digested, and it is swallowed because it is not digested, and it is swallowed because it is not digested, and it is swallowed because it is not digested. The blood is swallowed because it is not digested, and it is swallowed because it is not digested, and it is swallowed because it is not digested, and it is swallowed because it is not digested, and it is swallowed because it is not digested, and it is swallowed because it is not digested, and it is swallowed because it is not digested, and it is swallowed because it is not digested, and it is swallowed because it is not digested, and it is swallowed because it is not digested.<|eot_id|>","When you swallow blood, it enters your esophagus, a muscular tube that connects your mouth to your stomach. The stomach is a muscular sac that contains digestive enzymes, acids, and digestive fluids. When the blood enters the stomach, it is mixed with digestive enzymes which break down the blood into smaller pieces. The broken-down blood is then absorbed into the small intestine, where most of the digestion takes place.","When blood is swallowed, it passes through the esophagus and into the stomach. The stomach breaks down the blood into smaller pieces through the action of digestive enzymes and acids. The broken-down blood is then absorbed into the bloodstream.",0,1,1
"can you get different degrees of sunburn like you can with fire or chemical based burns? What is a sunburn, exactly, and how does it increase cancer risk?","Sunburn is not a chemical burn. The damage to your skin from the sun is not due to a chemical, but due to the UV radiation. Sunburns are caused by UV radiation from the sun. UV radiation is a type of electromagnetic radiation that is in the visible spectrum. UV radiation is what causes sunburn. UV radiation is also what causes sunburn on other planets. Sunburns are also what causes sunburn on other planets. Sunburns are not a chemical burn. Sunburns are not a chemical burn. Sunburns are not a chemical burn. Sunburns are not a chemical burn. Sunburns are not a chemical burn. Sunburns are not a chemical burn. Sunburns are not a chemical burn. Sunburns are not a chemical burn. Sunburns are not a chemical burn. Sunburns are not a chemical burn. Sunburns are not a chemical burn. Sunburns are not a chemical burn. Sunburns are not a chemical burn. Sunburns are not a chemical burn. Sunburns are not a chemical burn. Sunburns are not a chemical burn. Sunburns are not a chemical burn. Sunburns are not a chemical burn. Sunburns are not a chemical burn. Sunburns are not a chemical burn. Sunburns are not a chemical burn. Sunburns are not a chemical burn. Sunburns are not a chemical burn. Sunburns are not a chemical burn. Sunburns are not a chemical burn. Sunburns are not a chemical burn. Sunburns are not a chemical burn. Sunburns are not a chemical burn. Sunburns are not a chemical burn. Sunburns are not a chemical burn. Sunburns are not a chemical burn. Sunburns are not a chemical burn. Sunburns are not a chemical burn. Sunburns are not a chemical burn. Sunburns are not a chemical burn. Sunburns are not a chemical burn. Sunburns are not a chemical burn. Sunburns are not a chemical burn. Sunburns are not a chemical burn. Sunburns are not a chemical burn. Sunburns are not a chemical burn. Sunburns are not a chemical burn. Sunburns are not a chemical burn. Sunburns are not a chemical burn. Sunburns are not a chemical burn. Sunburns are not a chemical burn. Sunburns are not a chemical","A sunburn is a type of skin damage caused by prolonged exposure to ultraviolet (UV) radiation from the sun or tanning beds. UV radiation is a component of sunlight that can cause damage to the skin's outer layer, called the epidermis. Prolonged exposure to UV radiation can create an environment that fosters the growth of cancer cells. Sunburns can also increase the risk of eye damage, including cataracts and eye cancer.","A sunburn is a type of skin damage caused by prolonged exposure to ultraviolet (UV) radiation from the sun or tanning beds. UV radiation can cause damage to the skin's outer layer, leading to: 1. DNA damage: Mutations that can trigger cancer 2. Inflammation: Scarring and increased risk of skin cancer 3. Cancer cells: An environment that fosters cancer cell growth Sunburns come in different degrees, ranging from minor (first-degree) to severe (fourth-degree). Other risks associated with sunburns include: - Eye damage - Skin infections - Heatstroke To prevent sunburns and",0,1,1
"How come there is sunlight on Earth but right outside of Earth, in space, its pitch black?","The Sun's light is very, very bright, but it's only 6% of the total energy of the light that is emitted by the Sun. The Earth is about 30% of the total energy of the Sun's light. The Earth receives 4.3 watts of light per square meter, while the Sun receives 136 watts per square meter. This means that the Earth receives 30 times more light than the Sun, but it receives only about 1/5 as much energy. So the Earth is brighter than the Sun, but not by much. The Earth is also very, very close to the Sun, so the light it receives is much more intense than the light that reaches the Moon. The Moon is about 384,000 kilometers away from the Sun, while the Earth is only about 384,000 kilometers away from the Sun. So the light that reaches the Moon is much less intense than the light that reaches the Earth.<|eot_id|>","On Earth, the Sun appears bright because its orbit is tilted at an angle of about 23.5 degrees. This means that the Sun's light has to travel through a significant portion of the Earth's atmosphere to reach the surface. In contrast, other planets in our solar system have much closer orbits to the Sun. This results in less scattering of sunlight, which makes the Sun appear fainter.","The apparent difference in sunlight between Earth and other planets in our solar system is due to their orbits around the Sun. The tilt of their orbits causes the amount of sunlight reaching their surfaces to vary, with Earth's orbit being tilted at 23.5 degrees relative to the plane of the solar system. This results in more scattering of sunlight, making Earth appear brighter, while other planets appear fainter. For example, Mars appears as a rocky world with little atmosphere, while Venus appears as a bright world due to its close orbit.",0,1,1
How do satellites handle so many simultaneous connections?,"Satellites do not have to deal with multiple connections. It is the terrestrial network that has to deal with multiple connections. The terrestrial network is a complex system of cables, fiber optic cables, and satellites. When you connect to a satellite, you are connecting to the satellite directly. The satellite is a single device, and so you are only dealing with one device. The terrestrial network is a complex system of many devices, each of which can be connected to the satellite. Each device in the terrestrial network can be connected to the satellite, and so you are only dealing with one device in the terrestrial network. The satellite is a single device, and so you are only dealing with one device. The terrestrial network is a complex system of many devices, each of which can be connected to the satellite. Each device in the terrestrial network can be connected to the satellite, and so you are only dealing with one device. The satellite is a single device, and so you are only dealing with one device. The terrestrial network is a complex system of many devices, each of which can be connected to the satellite. Each device in the terrestrial network can be connected to the satellite, and so you are only dealing with one device. The satellite is a single device, and so you are only dealing with one device.<|eot_id|>","Satellites can handle multiple simultaneous connections through a combination of advanced technology and sophisticated management systems. Modern satellites are designed to operate in a high-speed, high-bandwidth environment. They are equipped with advanced signal processing and transmission systems, which enable them to handle multiple signals and data streams simultaneously.","Modern satellites can handle multiple simultaneous connections due to advanced technology and sophisticated management systems. Key factors include: - Advanced signal processing systems - Multiple transponders or transmitters - Satellite multiplexing techniques - Channel estimation, allocation, and management systems These features enable satellites to efficiently handle multiple connections, ensuring reliable and high-quality communication services in harsh environments.",0,1,1
Why is liposuction limited to a certain amount? Why can't doctors suck out 100 pounds of fat from a person that needs to lose 100 pounds?,"I'm not sure where you got the idea that it is limited to a certain amount. Liposuction is a procedure that is performed for cosmetic reasons, and is performed in a very controlled manner. The amount of fat that can be removed is not limited, and is not dependent on the size of the person. Liposuction is also performed for medical reasons, such as to remove excess fat that is causing health problems. For example, someone may have a large amount of fat in their liver. Liposuction may be used to remove this fat, and then the liver may be removed and replaced with a prosthetic. You can have a 100 pound person get liposuction and then have the liver removed, and have the liver replaced with a prosthetic. You can have a 100 pound person get liposuction and then have the liver removed and replaced with a prosthetic.<|eot_id|>","Liposuction is a surgical procedure that removes excess fat from the body. Doctors are limited to a certain amount of fat that can be removed because they need to balance the risks of surgery with the potential benefits of weight loss. A commonly cited limit is 2-3 inches (5-7.5 cm) of subcutaneous fat (the layer of fat just beneath the skin) This can vary depending on the individual's body composition, age, and other factors.","1. **Liposuction is a surgical procedure**: Removing excess fat from the body through surgery. 2. **Factors influence fat removal**: Body composition, age, genetics, and surgical technique all affect the amount of fat that can be removed. 3. **Doctors have a limit**: They can remove a certain amount of fat, usually 2-3 inches, but this varies from person to person and depends on individual factors.",0,1,1
