question,answer_LLAMA,summary_bart,summary_llama,label_LLAMA,label_bart,label_llama
How Photoshopping something out of a picture works.,"The original picture is a high-resolution image. When you edit it, you are essentially replacing parts of the image with new parts. The new parts are usually the same size and shape as the old parts, but they are not the same color. This means that the image will look like the old image, but it will also be slightly different. The software will then take a new image and compare it to the old image. If the new image is the same size and shape as the old image, the software will use the old image and replace the parts that were replaced. If the new image is smaller, the software will use the new image and remove parts of the old image. If the new image is larger, the software will use the new image and add parts to the old image. This is why the software will sometimes make the image look blurry or distorted. The software will also try to make the image look like the original image, but it will have to use parts of the new image instead of the old image.<|eot_id|>",Photoshopping is a sophisticated technique that requires a good understanding of image editing software and techniques. The process of photoshopping can be complex and requires patience and practice to achieve the desired results. Here's a step-by-step explanation of how it works.,"Photoshopping is a technique used to alter a photograph without removing it. It involves: 1. Pre-processing: Enhancing the image's brightness, contrast, and color balance. 2. Retouching: Removing objects or people using a retouching tool or selection tools. 3. Selection tools: Isolating the object or person using tools like ""Select"" in software. 4. Retouching algorithm: Analyzing the image to determine the best way to remove the object or person. 5. Removal algorithm: Using techniques like thresholding, edge detection, and noise reduction to remove the object or person accurately. 6. Exporting: Final edited image is exported for use",0,1,1
how does being tonedeaf work?,"When you're tonedeaf, you have a problem with your vocal cords. They're like a big muscle that you use to make sounds. When you're tonedeaf, they're smaller and weaker. It's like when you're 5 and you're not allowed to use your arms, but you can still use your legs. Your arms are smaller and weaker. When you're tonedeaf, your vocal cords are like your arms. They're smaller and weaker. So, when you try to make a sound, it's harder. Your voice sounds like a squeaky toy. It's not very good. It's like when you're 5 and you're not allowed to use your arms, but you can still use your legs. Your legs are smaller and weaker. Your legs are like your arms.<|eot_id|>","Being tone deaf is not a result of poor hearing, but rather a neurological condition. It is often associated with an abnormality in the auditory cortex. This area is responsible for processing sound. In individuals with a condition of being tone deaf, this processing is disrupted. As a result, the brain has difficulty processing the sound in a specific way.","Being ""tone deaf"" refers to a condition where a person has difficulty hearing and perceiving music, particularly in the higher frequency range. This condition is not caused by poor hearing, but rather a neurological issue affecting the brain's ability to process sound. The brain's auditory cortex is responsible for sound processing, but in individuals with a tone deaf condition, it becomes disrupted, leading to difficulties with sound perception and reproduction.",0,1,1
Contact lenses: what's the difference between dailies and longer wear lenses in terms of physical properties and manufacturing process? How does this impact retail cost?,"Dailies are made with a different type of material that is more flexible and easier to clean. They are also more durable. They are also more expensive. They are used for people who are near-sighted. Long wear lenses are made with a different material that is more durable and easier to clean. They are also less expensive. They are used for people who are farsighted. If you are nearsighted, you need to wear your contact lenses for a longer period of time because your eyes need to adjust to the contact lenses. If you are farsighted, you need to wear your contact lenses for a shorter period of time because your eyes need to adjust to the contact lenses.<|eot_id|>",Daily Wear Lenses (DAILIES) are designed to be worn for 16-24 hours. Longer wear lenses (LWELs) are often more cost-effective due to their simpler manufacturing process and lower cost materials. The cost of a DAILY lens can range from $20 to $50 per pair.,"Daily Wear Lenses (DAILIES) and Longer Wear Lenses (LWELs) are two types of contact lenses. - **Physical Properties:** - DAILIES are thin, flexible, and lightweight (16-24 hours). - They have a breathable membrane called a ""hydrogel"" that allows oxygen to reach the eye. - DAILIES are made from a combination of materials such as silicone hydrogel, collagen, and other polymers. - LWELs are thicker and more rigid (30 days to 1 month), made from a single piece of material like silicone or collagen. - **Manufacturing",0,1,1
"For concert, sports and any other events, the tickets get sold out almost immediately, then gigantic swaths of these tickets show up on broker websites for scalpers. How are brokers able to buy so many tickets using the same websites that I find not even functional to buy one.","The answer is that the people who are selling the tickets are not just the people who bought them. They're also the people who are buying them. The ticket broker is the middleman. The ticket broker buys tickets from the venue, and then sells them to the person who bought the ticket. The person who bought the ticket is not the same person who is selling the ticket. The ticket broker is not the same as the ticket vendor. The ticket vendor buys tickets from the venue, and then sells them to the ticket broker. The ticket broker then sells them to the person who bought the ticket. The ticket broker is not the same as the ticket vendor.<|eot_id|>","Ticketing platforms may not have the necessary security measures in place to prevent scalpers from buying large numbers of tickets. Brokers, also known as ""secondary ticket sellers,"" may be using the same websites to buy tickets as the primary ticket sellers. Scalers can use automated tools, such as bots or scripts, to buy Tickets quickly.","Ticketing platforms struggle with scalpers buying large numbers of tickets, often using automated tools. To combat this, platforms can implement measures such as: - Robust security measures - Increasing ticket availability - Improved brokerage and ticketing platform security - Monitoring and enforcement of ticketing regulations These measures can help prevent scalpers from buying tickets and ensure fair ticket sales.",0,1,1
why is there conflict in Syria?,"The conflict is a combination of the Syrian government's refusal to accept the legitimacy of the new government in the country, and the opposition's refusal to accept the legitimacy of the Syrian government. The opposition is led by a group called the Syrian National Coalition, which is an alliance of various groups that are opposed to the current government. The Syrian government is led by Bashar al-Assad, who is a member of the Ba'ath Party, a communist party that has been in power since 1963. The opposition is also led by the Syrian National Coalition, but it is not an alliance of all the groups that oppose the government. The Syrian government has been the de facto ruler of the country since 1971, and has been the de facto ruler of the country since 1991. The opposition has been the de facto ruler of the country since 2011.<|eot_id|>","The Syrian Civil War began in 2011, when a combination of factors, including the Arab Spring protests, economic and social unrest, and the Syrian government's suppression of dissent, led to widespread violence and conflict. Syria is predominantly Sunni Muslim, while the country has a significant Christian minority. The Syrian government has historically been seen as a Sunni-dominated entity, which has contributed to tensions with the minority Christian community.","The conflict in Syria is a complex and multifaceted issue with deep historical, cultural, and sectarian roots. The country has been divided and occupied by various powers throughout history, leading to ongoing tensions and rivalries. The conflict began in 2011 and has been fueled by external interference, border disputes, and humanitarian crises.",0,1,1
"If we were to launch a mirror into space at half the speed of light, what would we see in its reflection?","There is no such thing as a mirror that is perfect, and there is no such thing as a mirror that is perfect at all. The mirror would be reflecting light from an object that was traveling at the speed of light, and the light would be arriving at the mirror at the speed of light. Since the mirror is not perfect, the light would be diffracted and the image would be blurry. The speed of light is the speed at which all light travels, so even if the mirror was perfect, the light would still be diffracted and the image would still be blurry.<|eot_id|>","If we were to launch a mirror into space at half the speed of light, we would see a reflection of the mirror in the universe. This is known as a ""relativistic"" effect. At lower speeds, the effect is negligible, and the object would appear to be at rest.","Launching a mirror into space at half the speed of light would create a ""relativistic"" effect, where it appears to be at rest with respect to the universe, despite its actual speed of 0.5c relative to the universe.",0,1,1
What makes the biota in Amazon so diverse?,"I think you're talking about the Amazon rainforest, which is one of the most biodiverse places on the planet. It's not that there's more species, it's that there are more species in a single area than anywhere else on the planet. The Amazon rainforest is home to almost every type of plant and animal you can think of. It's not a ""wild"" place, it's a very dense forest with lots of plants and animals that have adapted to living in it. There are lots of different types of plants, like giant trees, giant ferns, giant epiphytes, giant vines, giant orchids, giant bromeliads, giant bromeliads, giant bromeliads, giant bromeliads, giant bromeliads, giant bromeliads, giant bromeliads, giant bromeliads, giant bromeliads, giant bromeliads, giant bromeliads, giant bromeliads, giant bromeliads, giant bromeliads, giant bromeliads, giant bromeliads, giant bromeliads, giant bromeliads, giant bromeliads, giant bromeliads, giant bromeliads, giant bromeliads, giant bromeliads, giant bromeliads, giant bromeliads, giant bromeliads, giant bromeliads, giant bromeliads, giant bromeliads, giant bromeliads, giant bromeliads, giant bromeliads, giant bromeliads, giant bromeliads, giant bromeliads, giant bromeliads, giant bromeliads, giant bromeliads, giant bromeliads, giant bromeliads, giant bromeliads, giant bromeliads, giant bromeliads, giant bromeliads, giant bromeliads, giant bromeliads, giant bromeliads, giant bromeliads, giant bromeliads, giant bromeliads, giant bromeliads, giant bromeliads, giant bromeliads, giant bromeliads, giant bromeliads, giant bromeliads, giant bromeliads, giant bromeliads, giant bromeliads, giant bromeliads, giant bromeliads, giant bromeliads, giant bromeliads, giant bromeliads, giant bromeliads, giant bromeliads, giant bromeliads, giant bromeliads, giant bromeliads, giant bromeliads, giant bromeliads, giant bromeliads, giant bromeliads, giant bromeliads, giant bromeliads, giant bromeliads, giant bromeliads","The Amazon rainforest is home to between 50% to 80% of all known species on Earth. It spans across nine countries in South America, including Brazil, Peru, Colombia, Venezuela, Ecuador, Bolivia, Guyana, Suriname, and French Guiana. This diversity of habitats creates a wide range of ecosystems, each supporting a unique set of plant and animal species.","The Amazon rainforest is incredibly diverse due to its unique geographical, climatic, and geological factors. The Amazon spans nine countries in South America, hosting a vast array of ecosystems, including tropical rainforest, savanna, and mangrove forests. The region receives an average of 2,000 mm of rainfall, leading to adaptations such as low-light survival and specialized roots. The Amazon's caves and underground spaces are home to unique species, and its islands provide a chance to study species evolution in isolation. The region's diverse ecosystems have been shaped by millions of years of evolution, leading to unique adaptations and species. Unfortunately, human activities such as deforestation, mining, and",0,1,1
What makes those long medical operations so long? How do surgeons make it through them?,"They make it through it because they are doctors, not surgeons. They are the ones who do the actual surgery. The surgeons are the ones who supervise the procedure and make sure that it is done correctly. The surgeons are also the ones who are the first to see the patient, the ones who make the first incision, and the ones who put the sutures. They are the ones who are the ones who are most skilled in surgery. They are the ones who know what to do to fix the patient.<|eot_id|>","Long medical operations, particularly those involving surgery, can be attributed to several factors. Surgeons must carefully plan and execute the operation, taking into account the patient's unique anatomy, potential complications, and the specific goals of the procedure.","The complexity of surgical procedures and time-consuming diagnostic tests can contribute to prolonged medical operations. Key factors that contribute to these long operations include: 1. Complexity of the procedure: Detailed planning and execution. 2. Diagnostic tests: Multiple visits to the hospital for confirmation. 3. Preparation and mobilization: Thorough preparation of the patient's body and operating room. 4. Surgical team preparation: Reviewing medical history, understanding the surgical plan, and coordinating with hospital staff. 5. Surgical site preparation: Disinfecting the area, setting up equipment, and preparing the patient's bed. 6. Potential complications: Anticipating risks such as bleeding, infection,",0,1,1
Why do enzymes denature when sitting out at room temperature but not inside our bodies?,"Enzymes are proteins that are made up of many different amino acids. The amino acids are linked together by a special molecule called a peptide bond. The peptide bonds are very strong and can withstand a lot of heat. The reason enzymes denature is because the heat causes the peptide bonds to break. The amino acids are so small that they can fit into a tight space and the peptide bonds are so strong that they can withstand the heat. If the enzyme is exposed to room temperature, the temperature is not high enough to cause the peptide bonds to break. The amino acids are so small that they can fit into a tight space and the peptide bonds are so strong that they can withstand the temperature. If the enzyme is exposed to room temperature, the temperature is not high enough to cause the peptide bonds to break. The reason enzymes don't denature in our bodies is because the temperature is high enough to cause the peptide bonds to break.<|eot_id|>","Enzymes are biological molecules, specifically proteins, that are essential for various cellular functions. They are highly specialized and work in a specific sequence to catalyze chemical reactions. When an enzyme is in its active form, it is highly organized and folded into its native conformation. At room temperature, enzymes are typically in their most stable and functional state. This is because enzymes are designed to work optimally within a narrow temperature range, typically between 25°C to 40°C.","Enzymes are biological molecules that are essential for various cellular functions. When exposed to room temperature, their native conformation is disrupted, leading to denaturation. This is because enzymes are highly organized and tightly bound to their substrate and other enzymes. At room temperature, their native conformation is unfolded, making it difficult for them to interact with their substrate and other enzymes. Denaturation is a process where the native conformation of an enzyme is lost, leading to a loss of activity. However, enzymes inside the human body are shielded from external factors and protected from denaturation, making denaturation less significant in this environment.",0,1,0
How do football commentators manage to know all the players' names at all times?,"They have access to the team rosters, and they have a lot of other information about the players that they can use. They can also get a lot of information from other sources. One way is that they can read the newspaper. The other way is that they can watch the games and look for the players' names on the scoreboard. In addition, they can also use the NFL's website, which has a list of all players in the league, along with their stats.<|eot_id|>","Football commentators typically have access to a large database of player information. They use this information to identify and name players during the game. Many teams use player tracking systems, which allow them to collect data on player positions, speeds, and other performance metrics.","Football commentators use a combination of sources to identify and name players during games. They research players, teams, and past performances before the game, and then use live data feeds from various sources during the game. This includes data from the National Football League (NFL), English Football League (EFL), National Basketball Association (NBA), and Major League Soccer (MLS). They also use player tracking systems and interviews with players to gather more information. Additionally, they consult media guides and publications to verify player information. By combining these sources, commentators can accurately and comprehensively cover football games.",1,1,1
Why can we get some diseases only once when others require vaccines every few years ?,"Vaccines are designed to be very effective, but they are not perfect. They are designed to be effective against a specific disease, and to only be effective against that disease. So if you get a disease, it's because you had a previous exposure to that disease. But if you don't have the disease, it's because you have no exposure to that disease. So you don't get it because you are not exposed to it, you get it because you were exposed to it in the past.<|eot_id|>","Some diseases, like the common cold or flu, can be contracted without symptoms, and the body may not mount a significant immune response. In these cases, the disease may only cause minor symptoms or no symptoms at all. Latent infections can be dormant in the body, waiting for the right conditions to reactivate. Some diseases may be more severe than others, leading to more severe symptoms or complications, even if the disease is contracted only once. Vaccination, on the other hand, can help prevent or treat diseases that require a sustained immune response, such as the malaria parasite.","Diseases that require vaccination every few years, such as the flu, often have mild or asymptomatic symptoms. These diseases can be contracted only once due to a combination of factors, including the type of disease, the body's immune response, and the disease's severity.",0,1,1
How did the USA become one nation?,"The American Revolution was a civil war between the colonies and the British Empire. After the war, the colonies were granted independence, and the newly formed United States of America was formed. The U.S. Constitution was written in 1787, and ratified in 1788. The Constitution was the first attempt at creating a federal government, and it was designed to be a strong central government, but it was also designed to allow states to have a degree of autonomy. The Constitution also granted the power of taxation to the federal government, and it established the principle that the federal government would be responsible for the defense of the country. The Constitution also established the principle that the federal government would be responsible for the rule of law, and it established the principle that the federal government would be responsible for the protection of the rights of the citizens of the country. The Constitution was ratified in 1788, and it became the law of the land.<|eot_id|>","The American Revolution began in 1774, when the Thirteen Colonies declared independence from Great Britain. In 1777, the Articles of Confederation were adopted, establishing a loose alliance of states. In June 1781, representatives from the 13 colonies gathered for a Constitutional Convention. The Convention drafted the United States Constitution, which was ratified in 1781.","The United States of America became a unified nation through a series of events, policies, and battles fought between 1775 and 1783. Key events included: - The American Revolution (1774-1776) began when the Thirteen Colonies declared independence from Great Britain. - The Continental Congress drafted the Declaration of Independence in 1776. - The Articles of Confederation were adopted in 1777, establishing a loose alliance of states. - The Constitutional Convention drafted the United States Constitution in 1781, which was ratified in 1781. - The Treaty of Paris (1783) officially ended the American Revolutionary War, recognizing American independence from Great Britain",0,1,1
How does the Space Station not run out of oxygen?,"The ISS is designed to run on a continuous supply of oxygen and fuel. The oxygen is stored in liquid form, and is pumped from the fuel tank into the ISS. The fuel is stored in solid form, and is pumped from the fuel tank into the ISS. The oxygen is consumed by the ISS's power systems, and the fuel is consumed by the ISS's propulsion systems. The ISS has two tanks that are used to store oxygen and fuel. The oxygen tank is located in the forward section of the ISS, and the fuel tank is located in the aft section of the ISS. The two tanks are separated by a small hatch that allows the crew to access the tank. The hatch is used to replace the oxygen and fuel tanks with new ones every 20 days. The ISS uses a combination of liquid oxygen and liquid hydrogen to power its propulsion systems. Liquid oxygen is used for the ISS's propulsion systems, and liquid hydrogen is used for the ISS's life support systems. The ISS also uses a combination of solid fuel and liquid fuel for its propulsion systems.<|eot_id|>","The Space Station's oxygen supply is not reliable due to supply chain issues, power outages, maintenance and repair issues, and the presence of space debris. To address these challenges, space agencies have implemented various strategies, including alternative oxygen sources, backup systems, ISRU, and closed-loop life support systems.","The Space Station's oxygen supply is unreliable due to limited oxygen generators, power outages, maintenance issues, and space debris. To address these challenges, space agencies have implemented strategies such as: - Alternative oxygen sources (e.g. liquid oxygen from fuel tanks) - Backup systems - In-situ resource utilization (ISRU) - Closed-loop life support systems These strategies aim to reduce reliance on external oxygen sources, minimize the need for external supplies, and improve overall oxygen production in space.",0,1,1
"Before Revealing Himself as ""Yahweh"" to Moses, What was the Hebrew God Called?","You may be interested in the [FAQ section on the Israelites and their gods](_URL_0_) in the FAQ wiki, which includes a section on the ""names"" of the Israelites' gods. There's also a [thread on the name of the first king of Israel](_URL_1_), which has a lot of information on the names of the various gods worshipped in the ancient Near East. The thread is called ""The Name of the First King of Israel: What was it?"" and has a lot of links to relevant information. I hope this helps!<|eot_id|>","Elohim is a term used in the Hebrew Bible (Old Testament) to refer to the creator and sustainer of the universe. It is often translated as ""God"" or ""divine being"", but it is actually a more general term that encompasses various aspects of the divine.",", The text states that before revealing himself as ""Yahweh"" to Moses, the Hebrew God was referred to as ""Elohim"" in the Hebrew Bible. This term is a general term that encompasses various aspects of the divine, and is often used in conjunction with other terms such as ""Yahweh"", ""El Shaddai"", and ""Adonai"".",1,1,1
