question,answer_LLAMA,summary_bart,summary_llama,label_LLAMA,label_bart,label_llama
"Why is the ""Black Death"" mentioned so often in western history but not Chinese history even though it originated there?","The Black Death is a very famous event in European history. It was a major factor in the rise of the nation-states of Europe. It's not like that in China. The plague didn't have a major impact on the political landscape of China. The plague didn't even make it to China. It was in Europe, and it's not like that in Asia. The plague didn't have a major impact on the political landscape of China. The plague didn't even make it to China. If you're interested in reading more about the Black Death, I recommend the book *The Plague* by Robin Brooks. It's a great read, and it's very well written.<|eot_id|>","The ""Black Death"" originated in the Middle East and was introduced to Europe through the Silk Road. European records of the plague are limited and often biased. In Chinese culture, the plague is often seen as a natural disaster or a punishment from heaven.","The ""Black Death"" is a historical phenomenon that occurred in Europe and spread globally, but its significance in Chinese history is largely forgotten. Limited European records, cultural sensitivity, and a lack of European influence have contributed to this lack of documentation. Archaeological evidence is also scarce in China. However, Chinese historians have written about the plague in their books, and there are records of outbreaks in China during the 14th century. Despite these efforts, much more work needs to be done to fully understand the plague's historical significance in China.",0,1,1
How historically accurate is the show The Last Kingdom on Netflix?,"I've watched the first season of the show and I'm not sure if you are asking for historical accuracy, but I would say that it is mostly accurate, except for the characters. I am not sure if you are asking for accuracy in terms of the setting, but I am sure that the show is mostly accurate in terms of the setting. The show is set in the 9th century, and the show's setting is the 9th century, so it is accurate. The show is set in a very similar time period to the Viking Age, so it is accurate in terms of clothing, weapons, and the like. However, the show is set in a very different time period than the Viking Age, and so it is not accurate in terms of politics, religion, and culture. I'm not sure if you are asking for accuracy in terms of the characters, but I would say that the show is mostly accurate. The characters are mostly based on historical figures, but I don't know if they are accurate.<|eot_id|>","The Last Kingdom is a historical drama series based on the novels by Bernard Cornwell. While the show takes creative liberties with the past, it does draw inspiration from historical records and archaeological findings. Here's a breakdown of its historical accuracy.","The Last Kingdom, a historical drama series, is set in 9th-century England. It draws inspiration from historical records and archaeological findings, but takes creative liberties to create a compelling narrative. The show's timeline is generally accurate, with events taking place from 870-900 AD. The portrayal of historical events, such as the Roman withdrawal, Viking invasions, and Saxon kingdoms, is mostly accurate, but some artistic liberties are taken, including exaggerated Viking raids and a gradual Roman withdrawal.",0,1,1
"If there was a lack of food supply in the world, could we survive of of just vitamins and a high concentration of calories? Or do we HAVE to eat in order to live?","There's a lot of food out there. You just need to have a good supply of it. I know it sounds crazy, but I've seen people survive on very little food and still have a good supply of it. The problem is, you have to have a good supply of food to begin with. You can't just go out and find a good supply of food. You need to have a good supply of food before you can go out and find it. You need to have a good supply of food before you can eat it. You need to have a good supply of food before you can find it. You need to have a good supply of food before you can eat it. You need to have a good supply of food before you can find it. You need to have a good supply of food before you can eat it. You need to have a good supply of food before you can find it. You need to have a good supply of food before you can eat it. You need to have a good supply of food before you can find it. You need to have a good supply of food before you can eat it.<|eot_id|>","Vitamins are crucial for various bodily functions, including energy production, nerve function, and immune system function. Without sufficient protein, our bodies would not be able to build and maintain muscles, bones, and other tissues. Adequate hydration is essential for our bodies to function properly.","Humans need a balanced diet that includes various food groups to survive. A diet consisting only of vitamins and high-calorie foods would be extremely challenging, if not impossible, for humans. The lack of essential nutrients like vitamins, minerals, and proteins would lead to severe consequences, including malnutrition, organ damage, and increased risk of disease. In extreme cases, starvation could lead to widespread starvation, malnutrition-related deaths, and catastrophic mortality rates. Therefore, humans need a balanced diet that includes a variety of foods from all food groups to maintain optimal health and well-being.",0,1,1
"If our DNA varies from person to person, how do we know how closely human DNA resembles that of orangutans?","Humans have 23 pairs of chromosomes, and each pair has 2 genes. Each gene has 2 alleles, which are the two versions of the gene. Humans have 23 pairs of chromosomes, and each pair has 2 genes, and each gene has 2 alleles. The alleles are called *alleles* because they are not the same, but the same type of allele is called a *allele* and the *alleles* themselves are called *alleles*. In humans, there are 23 pairs of chromosomes, and each pair has 2 genes, and each gene has 2 alleles. So, the human chromosome has 46 *alleles*. The orangutan has 23 pairs of chromosomes, and each pair has 2 genes, and each gene has 2 alleles. So, the orangutan chromosome has 46 *alleles*. So, when we look at the human chromosome, we can see that it has 46 *alleles*, and when we look at the orangutan chromosome, we can see that it has 46 *alleles*. This means that the orangutan chromosome is 46% similar to the human chromosome, and the human chromosome is 46% similar to the orangutan chromosome.<|eot_id|>","The first step is to sequence the DNA of a human or orangutan. This involves breaking the DNA into smaller pieces and then reassembling them into a complete sequence. Once the DNA sequence is obtained, researchers use genotyping techniques to identify specific genetic markers. These markers are the building blocks of DNA and are responsible for certain traits or characteristics. By comparing the genetic markers between humans and orangutans, researchers can identify the similarities and differences.","Researchers compare human DNA to that of orangutans using various genetic markers and methods. They sequence human DNA, identify specific genetic markers, and compare them to orangutan DNA using statistical methods and tools. This helps to identify similarities and differences between the two species, including genetic markers unique to orangutans and those shared with humans. The study aims to understand the genetic differences between humans and orangutans, with the genetic similarity between humans and orangutans estimated to be around 80-90%.",0,1,1
"Why would a company spend millions on a long Superbowl commercial, only to leak it online a week before the Superbowl?","If you want to get a lot of attention, you want to get people talking about your product. If you want to get a lot of attention, you want to get people talking about your product and your company. You can get a lot of attention by having a big event happen. You can get a lot of attention by having a big event happen and having it happen in a very specific location. You can get a lot of attention by having a big event happen in a very specific location and having it happen in a very specific location. In short, you can get a lot of attention by having a big event happen in a very specific location, or you can have a big event happen in a very specific location and then having it happen in a very specific location. The way it works is that you want to get attention in a very specific location, and then you want to get attention in a very specific location.<|eot_id|>",Companies often spend millions on Super Bowl commercials to generate significant buzz and publicity. Leaking the commercial online can increase viewership and engagement on social media. Releasing a successful Super Bowl commercial can be seen as a way for the company to demonstrate their commitment to their brand.,"Companies often spend millions on Super Bowl commercials to generate buzz and publicity. However, they may leak the content online a week before the big game to create more excitement and interest. This can lead to increased viewership, engagement, sales, and media coverage. Additionally, it can demonstrate a company's commitment to their brand and fans. However, leaking a successful commercial online can also have negative consequences, such as damaging reputation, violating regulations, and losing trust. Ultimately, companies should carefully consider the risks and benefits before deciding to leak a Super Bowl commercial online.",0,1,1
Question about Popes and alliances in 1500's Europe...,"The Pope is the head of the Catholic Church, and as such is the head of the Catholic Church in Europe. He is not a political leader in the way that a king is. His power is more symbolic. His power is the power of the Church. He is the Pope, and he has a lot of influence over the Catholic Church. He is the Pope, and he has a lot of influence over the European monarchs. The Pope is not a political leader, and the Pope is not a monarch. The Pope is the Pope. So, the Pope is not really in a position to make alliances with monarchs. The Pope is not a political leader, and the Pope is not a monarch. The Pope is the Pope. He is not a political leader, and he is not a monarch. He is the Pope.<|eot_id|>","In the 1500s, European politics was dominated by powerful monarchs and the Catholic Church. Here's a brief overview of the major alliances and popes of that era.","The 1500s European politics were dominated by powerful monarchs and the Catholic Church. Key alliances included: - Spanish Empire (King Ferdinand II) allied itself with the Holy Roman Empire. - French monarchy (King Henry II) allied itself with the Holy Roman Empire. - German states (Duke Charles V) formed alliances with various German states. The Pope of the Catholic Church played a significant role in these alliances, often supporting the Habsburgs and the Spanish Empire. Key Popes included: - Paul III (1465-1540) - Pius IV (1550-1559) - Pius V (1559-1566) - Pius VI",0,1,0
"[20th Century Russia] I'm about done with my first read of ""War and Peace"", and I'm curious how the book was regarded by the Soviets.","It was a huge hit, especially in the first half of the 20th century. The Soviet Union was still a relatively new entity at that time, and it was very popular among the Soviet people. The book was also a huge success in the West, where it was translated into a number of languages, and it was published in many different countries. It's also notable for being the first Russian novel to be translated into English. It's also notable for being the first novel to be translated into English that was written by a Russian. It was also translated into many other languages, and it was translated into the French, German, Italian, and many other languages. It was also translated into many different languages, including Chinese, which is an official language of the Chinese government. It was also translated into many different languages, including Arabic, and it was translated into the Hebrew. It was also translated into many different languages, including Welsh, and it was translated into the Icelandic. It was also translated into many different languages, including the Danish, and it was translated into the Swedish. It was also translated into many different languages, including the Finnish, and it was translated into the Norwegian. It was also translated into many different languages, including the Dutch, and it was translated into the Polish. It was also translated into many different languages, including the Swedish, and it was translated into the Swedish. It was also translated into many different languages, including the Finnish, and it was translated into the Norwegian. It was also translated into many different languages, including the Swedish, and it was translated into the Swedish. It was also translated into many different languages, including the Finnish, and it was translated into the Norwegian. It was also translated into many different languages, including the Swedish, and it was translated into the Swedish. It was also translated into many different languages, including the Swedish.<|eot_id|>","In 20th-century Russia, ""War and Peace"" by Leo Tolstoy was a highly acclaimed and influential work. The book was widely regarded by the Soviets as a masterpiece of literature. It was seen as a powerful indictment of the existing social order and a call for radical change.","""War and Peace"" by Leo Tolstoy was a highly acclaimed and influential work in 20th-century Russia, widely regarded by the Soviets as a masterpiece of literature. The book was seen as a powerful critique of the social and economic systems of the time, providing a detailed analysis of the Russian peasantry's struggle for better living conditions and social justice. The Soviet government used the book to justify their policies of collectivization, forced industrialization, and social reform, but also saw it as a potential threat to their power and influence.",0,1,1
Why are advertisements for colognes and perfumes so strange?,"I have a theory. Perfumes are expensive, and you are going to want to buy a lot of them. So you want to buy the most expensive one. That's why you see them in a lot of ads. You want to buy a lot of them, so you want to show them off. Also, perfumes are very strong, so you want to be able to smell them from a distance. So you want to show them off from a distance. I think the other reason is that perfume ads are often very expensive to make. You want to show off how expensive they are, so you want to put them in an expensive setting. I don't know the full story, but I think these are the main reasons.<|eot_id|>",Using unusual and vivid imagery can help capture the viewer's attention. Perfumes and colognes aim to evoke emotions and create a sensory experience. These unusual advertisements can be effective in creating a memorable brand identity.,"Perfume and cologne advertisements often feature unusual and unconventional imagery to capture attention, create a memorable brand identity, and evoke emotions. Examples include using bold, neon letters, full-body spandex suits, wedding dresses, and black hooded cloaks. These ads can be effective in creating a strong brand image and evoking emotions in the viewer.",0,1,1
"Friday Free-for-All | April 07, 2017","I am an English major and I am currently studying for my Master's degree in English Literature. I have been working for a few years as a freelance editor and I am now looking to move into a more stable position. I am hoping to find a position that will allow me to continue working with English literature, but also give me the opportunity to work with other types of texts as well. I am interested in the field of American Literature, and I have been working with American literature for a few years now. I am hoping to find a position that will allow me to work with American Literature, but also give me the opportunity to work with other types of texts. I am also interested in the field of American Literature, and I have been working with American Literature for a few years now. I am hoping to find a position that will allow me to work with American Literature, but also give me the opportunity to work with other types of texts. I am also interested in the field of American Literature, and I have been working with American Literature for a few years now. I am hoping to find a position that will allow me to work with American Literature, but also give me the opportunity to work with other types of texts. I am also interested in the field of American Literature, and I have been working with American Literature for a few years now. I am hoping to find a position that will allow me to work with American Literature, but also give me the opportunity to work with other types of texts. I am also interested in the field of American Literature, and I have been working with American Literature for a few years now. I am hoping to find a position that will allow me to work with American Literature, but also give me the opportunity to work with other types of texts. I am also interested in the field of American Literature, and I have been working with American Literature for a few years now. I am hoping to find a position that will allow me to work with American Literature, but also give me the opportunity to work with other types of texts. I am also interested in the field of American Literature, and I have been working with American Literature for a few years now. I am hoping to find a position that will allow me to work with American Literature, but also give me the opportunity to work with other types of texts. I am also interested in the field of American Literature, and I have been working with American Literature for a few years now. I am hoping to find a position that will allow me to work with American Literature, but","The term ""free-for- for-hall"" is believed to have originated from the 19th-century American social scene. In the context of the original date, April 7, 2017, it's likely that the event was a casual gathering or a party.","A ""Friday Free-for-All"" event from 2017 was an informal gathering where people socialized, had fun, and engaged in activities like music, dance, and food. The term is believed to have originated from 19th-century American social scenes, where people would come and go as they pleased.",0,1,1
Do lie detectors work?,"The lie detector works by measuring changes in your heart rate, blood pressure, and other physiological responses to stress. It's been shown to be fairly accurate, but it's not perfect. It's also been shown to be unreliable in certain situations, such as when you're lying about something that is not relevant to the test. If you're lying about something that is relevant, it's possible that your lie detector will show you as telling the truth, but this is not necessarily the case. It's also worth noting that the lie detector is not a reliable method of determining whether someone is lying. It's not a reliable method of determining whether someone is telling the truth, and it's not a reliable method of determining whether someone is lying about something that is not relevant to the test.<|eot_id|>","Lie detectors are devices used to measure physiological responses to stress or anxiety. They are designed to detect deception by analyzing changes in heart rate, blood pressure, and other physiological responses. The effectiveness of lie detectors is debated, and their reliability is not universally accepted.","Lie detectors, also known as polygraph tests, measure physiological responses to stress or anxiety. However, their accuracy is debated and not universally accepted. Factors such as stress, variability in responses, and test conditions can affect their reliability. As a result, experts recommend using lie detectors in conjunction with other methods to evaluate a person's credibility, rather than relying solely on their results.",0,1,1
Why do things only burn in high atmosphere?,The main reason is that the air in the atmosphere is mostly nitrogen and oxygen. The nitrogen and oxygen are very stable molecules and they do not react with each other easily. The nitrogen and oxygen in the atmosphere are also the main components of the atmosphere. The reason they are the main components is because they are the stable molecules. The air in the atmosphere is mostly nitrogen and oxygen because they are the stable molecules. The nitrogen and oxygen in the atmosphere are also the main components of the atmosphere because they are the stable molecules. The other reason is that the temperature of the atmosphere is relatively low. The temperature of the atmosphere is also relatively low. The nitrogen and oxygen in the atmosphere are also the main components of the atmosphere because they are the stable molecules. The nitrogen and oxygen in the atmosphere are also the main components of the atmosphere because they are the stable molecules. The temperature of the atmosphere is also relatively low. The nitrogen and oxygen in the atmosphere are also the main components of the atmosphere because they are the stable molecules.<|eot_id|>,"In the high atmosphere, things don't typically burn because of the unique combination of factors that create an environment hostile to combustion. Low Pressure: The atmospheric pressure decreases with altitude, making it easier for gases to escape into space. Limited Oxygen: The high atmosphere has lower oxygen levels, which are necessary for combustion to occur. Radiative Cooling: The atmosphere radiates heat back into space, which counteracts any heat generated by combustion.","The high atmosphere is hostile to combustion due to several factors, including: - Decreased atmospheric pressure - Thin atmosphere - Cooling effect from the Earth's surface - Radiative cooling - Limited oxygen These factors make combustion impossible in the high atmosphere, which is in contact with the cold Earth's surface.",0,1,1
How were Genghis Khan and the Mongols perceived in Chinese historiography?,"The Chinese view of the Mongols is a little complicated, but the short answer is that they are not really viewed as a ""civilization"" in the same way as the Chinese did. The Mongols were seen as a ""barbarian"" force, and were often referred to as ""barbarians"" (, gāng). The Chinese were wary of the Mongols, but they were not particularly afraid of them. The Mongols were not the same as the ""barbarians"" of the previous era, but they were not the same as the ""barbarians"" of the next era. They were a ""barbarian"" force, but they were not the same as the ""barbarians"" of the previous era, and they were not the same as the ""barbarians"" of the next era.<|eot_id|>","The Mongols were not widely known or revered in Chinese historiography. With the rise of the Yuan Dynasty (1271-1368) and the subsequent Mongol invasions, the Mongols gained a significant following among the Chinese population. Over time, the Chinese perception of Mongols has shifted, and they are now seen as a complex and multifaceted force.","The Chinese perception of Genghis Khan and the Mongols has evolved over time. Initially, the Mongols were not widely known or revered in Chinese historiography. However, with the rise of the Yuan Dynasty and subsequent Mongol invasions, the Mongols gained a significant following. Chinese historian Chen Shoufu (1290-1362) wrote ""The Records of the Three Kingdoms"" (Sanzheng), which portrayed the Mongols as a powerful force with military, cultural, and economic achievements. Over time, the Chinese perception shifted, and they are now seen as a complex force, symbolizing the struggle for Mongolian independence and self-determination",0,1,1
"With clothes that are years old, when they go through the dryer...there is always a huge amount of lint in the dryer trap. Where does the lint keep coming from since the clothes / towels don't ""seem"" to be disintegrating?","Mostly it's from the clothes that are washed and then dried. The lint is just the small fibers that are left in the wash water. They're not really broken down into a usable form. They're just like a bunch of tiny hairs that are floating in the water. The fibers in the clothes are broken down by the wash water, and the lint is left behind. The lint is the same stuff that comes out of the washing machine, but it's just a bunch of tiny fibers that have been left behind.<|eot_id|>","Dryer lint is a mixture of fibers, lint, and other debris that are shed from clothing and towels during the drying process. Lint can also come from other household items, such as dryer sheets or fabric softener sheets. To reduce the amount of lint in your dryer trap, try the following.","Dryer lint, also known as ""oven lint,"" is a mixture of fibers, lint, and other debris shed from clothing and towels during the drying process. It can come from various sources, including fabric fibers, other household items, and lint from other household items. To reduce dryer lint, try the following: - Regularly clean the lint filter - Use a lint roller or brush to remove lint and debris - Wash clothes and towels regularly - Use a low-heat setting - Check and clean the lint trap regularly",1,1,0
